provider_id,full_name,credentials,title,board_certifications,license_number,license_state,license_status,license_verification_url,npi_number,years_experience,year_started_practicing,clinic_id,tagline,bio,profile_photo_url,languages,gender,treatments_offered,specialties,pricing_botox_per_unit,pricing_filler_per_syringe,pricing_consultation,accepts_new_patients,offers_virtual_consult,offers_in_person,website_url,email,phone_direct,instagram_url,aggregate_rating,aggregate_rating_count,source_urls,last_scraped_date
prov-hou-00001,Sarah Kim,MD,Board-Certified Dermatologist,Dermatology; AAD Fellow,TX12345,TX,Active,https://profile.tmb.state.tx.us/Lookup,1902345671,12,2014,clinic-hou-00001,"Conservative, natural injectables in River Oaks.","Dr. Kim trained at Baylor and focuses on neurotoxins and tear-trough filler.",https://i.pravatar.cc/200?img=31,English; Korean,Female,Botox; Dysport; Lip Filler; Tear Trough,Forehead; Tear Trough,16,850,100,true,true,true,https://memorialaesthetics.example/sarah-kim,sarah@memorialaesthetics.example,+17135550111,https://instagram.com/drsarahkim,4.8,142,https://injector.world/seed-sample,2026-06-04
prov-hou-00002,Marcus Allen,PA,"Physician Assistant, Aesthetic Medicine",,PA88776,TX,Active,https://profile.tmb.state.tx.us/Lookup,1902345672,7,2019,clinic-hou-00001,Masseter and jawline focused PA.,"Seven years in aesthetic medicine with a focus on lower-face balance.",https://i.pravatar.cc/200?img=15,English; Spanish,Male,Botox; Masseter Botox,Masseter; Jawline,14,,75,true,false,true,,marcus@memorialaesthetics.example,+17135550112,,4.7,71,https://injector.world/seed-sample,2026-06-04
prov-hou-00003,Sarah Kim,MD,Board-Certified Dermatologist,Dermatology,TX12345,TX,Active,https://profile.tmb.state.tx.us/Lookup,1902345671,12,2014,clinic-hou-00002,Duplicate row to test dedupe.,"This row intentionally duplicates prov-hou-00001 (same name + state + license number) to exercise the duplicate detector.",https://i.pravatar.cc/200?img=31,English,Female,Botox,Forehead,16,,100,true,false,true,,,,,4.8,142,https://injector.world/seed-sample,2026-06-04
prov-hou-00004,Priya Nair,NP,Aesthetic Nurse Practitioner,,NP55512,TX,Active,https://profile.tmb.state.tx.us/Lookup,1902345674,9,2017,clinic-hou-00002,Tear-trough and lip specialist.,"Nurse practitioner with a focus on under-eye and lip work.",https://i.pravatar.cc/200?img=27,English; Hindi,Female,Botox; Tear Trough; Fat Dissolving,Tear Trough; Lips,13,800,80,true,true,true,,priya@bayoucityderm.example,+17135550113,,4.9,98,https://injector.world/seed-sample,2026-06-04
prov-nyc-90001,David Stern,MD,Board-Certified Plastic Surgeon,Plastic Surgery,998877,NY,Active,https://op.nysed.gov/verification-search,1902345675,15,2011,clinic-nyc-90001,Biostimulator and mid-face specialist.,"Plastic surgeon focused on Sculptra and cheek balance.",https://i.pravatar.cc/200?img=51,English,Male,Botox; Cheek Filler; Sculptra,Cheeks; Mid-face,18,1100,150,true,false,true,https://madaveaesthetics.example/david-stern,,+12125550311,,4.9,221,https://injector.world/seed-sample,2026-06-04
prov-la-90001,Elena Cruz,RN,Aesthetic Registered Nurse,,RN334455,CA,Active,https://search.dca.ca.gov/,1902345676,6,2020,clinic-la-90001,Lip and skin focused RN.,"Aesthetic RN focused on natural lip work and skin rejuvenation.",https://i.pravatar.cc/200?img=22,English; Spanish,Female,Botox; Lip Filler; Microneedling,Lips; Skin,15,780,0,true,true,true,,elena@sunsetderm.example,+13105550411,https://instagram.com/elenacruzrn,4.8,134,https://injector.world/seed-sample,2026-06-04
