review_id,provider_id,clinic_id,reviewer_first_name,reviewer_initial,reviewer_age_range,reviewer_city,rating,review_title,review_text,treatment_tag,review_date,source_platform,source_url,response_from_provider,response_date
rev-90000001,prov-hou-00001,clinic-hou-00001,Ashley,M,30-34,River Oaks,5,Natural and exactly right,"Dr. Kim took time to map my face before any injection. The result is subtle and natural.",Botox,2026-05-10,google,https://google.com/review/sample1,,
rev-90000002,prov-hou-00002,clinic-hou-00001,Brandon,T,35-39,Midtown,4,Great masseter result,"Came in for jaw slimming and TMJ relief. Both improved within a few weeks.",Masseter Botox,2026-05-02,google,https://google.com/review/sample2,,
rev-90000003,prov-nyc-90001,clinic-nyc-90001,Rachel,G,40-44,Upper East Side,5,Best Sculptra in the city,"Built slowly and looks like I just look more rested. No one has guessed.",Sculptra,2026-04-28,healthgrades,https://healthgrades.com/review/sample3,"Thank you Rachel, see you at your next session.",2026-04-30
rev-90000004,prov-la-90001,clinic-la-90001,Maria,L,25-29,West Hollywood,5,Lip filler done right,"Subtle and balanced. Did not look swollen the next day.",Lip Filler,2026-05-15,yelp,https://yelp.com/review/sample4,,
rev-90000005,prov-hou-99999,clinic-hou-00002,Jordan,P,30-34,Downtown,5,Excellent care,"This review intentionally references a provider id that does not exist, to exercise the broken-relationship detector.",Botox,2026-05-18,google,https://google.com/review/sample5,,
rev-90000006,,clinic-hou-00002,Taylor,B,35-39,Heights,4,Clean and professional,"Clinic-level review with no specific provider named. Should attach to the clinic only.",Botox,2026-05-20,vitals,https://vitals.com/review/sample6,,
